[
  {
    "id": "pb_001",
    "key": "route.super_admin.automation_ai_center.load",
    "name": "Automation & AI Center route load",
    "scopeType": "route",
    "module": "system",
    "target": "time_to_usable_ui",
    "targetValue": 3000,
    "unit": "ms",
    "currentValue": null,
    "status": "not_tested",
    "owner": "platform_team",
    "lastTestedAt": null,
    "notes": "Slice 1 target; measure after UI exists."
  },
  {
    "id": "pb_002",
    "key": "route.company.booking_list.api_calls",
    "name": "Booking List initial API calls",
    "scopeType": "route",
    "module": "schedule",
    "target": "initial_api_call_count",
    "targetValue": 6,
    "unit": "calls",
    "currentValue": null,
    "status": "not_tested",
    "owner": "schedule_team",
    "lastTestedAt": null,
    "notes": "Prevent duplicate initial fetches."
  },
  {
    "id": "pb_003",
    "key": "endpoint.schedule.range.p95",
    "name": "Schedule range endpoint p95",
    "scopeType": "endpoint",
    "module": "schedule",
    "target": "p95_latency",
    "targetValue": 1500,
    "unit": "ms",
    "currentValue": 820,
    "status": "passing",
    "owner": "schedule_team",
    "lastTestedAt": "2026-06-11T12:00:00Z",
    "notes": "Mock baseline only."
  },
  {
    "id": "pb_004",
    "key": "endpoint.invoices.export.timeout",
    "name": "Invoice export timeout budget",
    "scopeType": "job",
    "module": "invoices",
    "target": "job_timeout",
    "targetValue": 30000,
    "unit": "ms",
    "currentValue": 30000,
    "status": "warning",
    "owner": "finance_team",
    "lastTestedAt": "2026-06-11T12:00:00Z",
    "notes": "Export should become queued/concurrency limited."
  },
  {
    "id": "pb_005",
    "key": "endpoint.ai.chat.p95",
    "name": "AI chat response p95",
    "scopeType": "ai_feature",
    "module": "chat",
    "target": "p95_latency",
    "targetValue": 5000,
    "unit": "ms",
    "currentValue": null,
    "status": "not_tested",
    "owner": "ai_team",
    "lastTestedAt": null,
    "notes": "Requires provider timeout and circuit breaker."
  },
  {
    "id": "pb_006",
    "key": "frontend.schedule.bundle",
    "name": "Schedule route JS budget",
    "scopeType": "frontend_bundle",
    "module": "schedule",
    "target": "route_js_budget",
    "targetValue": 350,
    "unit": "kb",
    "currentValue": null,
    "status": "not_tested",
    "owner": "frontend_team",
    "lastTestedAt": null,
    "notes": "Target must be calibrated after current repo baseline."
  },
  {
    "id": "pb_007",
    "key": "db.customer_card.detail.query",
    "name": "Customer Card detail query budget",
    "scopeType": "database_query",
    "module": "customer_card",
    "target": "p95_query_duration",
    "targetValue": 500,
    "unit": "ms",
    "currentValue": null,
    "status": "not_tested",
    "owner": "customer_team",
    "lastTestedAt": null,
    "notes": "Review joins/RLS/indexes with realistic data."
  }
]
